{"episodes":[{"diffs":[],"episode_index":0,"replay_hash":{"recomputed":"sha256:e533088162409df5afbca9b03f069b1d904ecf4943d1dbaa21b2ff23bd436147","reported":"sha256:e533088162409df5afbca9b03f069b1d904ecf4943d1dbaa21b2ff23bd436147"},"seed":20260720,"status":"match"}],"errors":[],"exitCode":0,"hosted_seal":{"bundle_files":0,"mismatch":[],"sarif_equal":true,"seal":[],"sealed":false},"ok":true,"provenance":[{"driver":"target","episode_index":0,"inputs_digest":"match","inputs_source":"recorded","label":"recorded, replayed","seat":"m0","verification":"recorded_replayed"},{"driver":"target","episode_index":0,"inputs_digest":"match","inputs_source":"recorded","label":"recorded, replayed","seat":"m1","verification":"recorded_replayed"},{"driver":"target","episode_index":0,"inputs_digest":"match","inputs_source":"recorded","label":"recorded, replayed","seat":"m2","verification":"recorded_replayed"},{"driver":"target","episode_index":0,"inputs_digest":"match","inputs_source":"recorded","label":"recorded, replayed","seat":"m3","verification":"recorded_replayed"},{"driver":"target","episode_index":0,"inputs_digest":"match","inputs_source":"recorded","label":"recorded, replayed","seat":"m4","verification":"recorded_replayed"}],"recorded_seats":[],"run":[],"signature":{"checked":false,"errors":[],"status":"not_checked"},"signed_forms":{},"status":"verified","unverified":["/episodes/0/duration_ms","/not_assessed/0","/not_assessed/1","/not_assessed/2","/run/finished_at","/run/hosted","/run/mode","/run/started_at","/run/target_ownership","/run/tool"]}